[
  {
    "semantic_rule_id": "SR-MR-003-01",
    "version": "1.0",
    "source": {
      "doc_id": "lme_matching_rules_v2_2",
      "doc_title": "LME Matching Rules",
      "doc_version": "2.2",
      "section": "General Information",
      "clause_refs": [
        "3"
      ],
      "atomic_rule_ids": [
        "MR-003-01"
      ],
      "pages": [
        2
      ]
    },
    "classification": {
      "rule_type": "obligation",
      "rule_tags": [
        "price"
      ],
      "testability": "testable",
      "priority": "medium",
      "coverage_eligible": true
    },
    "statement": {
      "actor": {
        "value": "member",
        "source_type": "normalized"
      },
      "action": {
        "value": "contact_exchange",
        "source_type": "normalized"
      },
      "object": {
        "value": "trade",
        "source_type": "normalized"
      },
      "conditions": [
        {
          "id": "C1",
          "kind": "document_context",
          "field": "context_clause",
          "operator": "equals",
          "value": "Where an order or trade fails the price validation check",
          "source_type": "explicit"
        }
      ],
      "constraints": [],
      "outcome": {
        "kind": "acceptance",
        "expected_state": "action_required",
        "details": {}
      },
      "exceptions": []
    },
    "type_payload": {
      "obligation": {
        "mode": "must",
        "fulfillment": "required"
      }
    },
    "execution_mapping": {
      "business_inputs": [
        "price",
        "trade"
      ],
      "observable_outputs": [
        "validation_result",
        "processing_result"
      ],
      "system_events": [
        "contact_exchange"
      ],
      "preconditions_for_execution": [],
      "postconditions_for_execution": [
        "obligation"
      ],
      "dsl_assertions": [
        {
          "target": "processing_result",
          "operator": "not_equals",
          "value": null
        }
      ]
    },
    "evidence": [
      {
        "target": "statement",
        "quote": "Where an order or trade fails the price validation check, Members are required to contact the Exchange to explain the rationale as to the price of the rejected order or trade.",
        "page": 2,
        "atomic_rule_id": "MR-003-01"
      }
    ],
    "review": {
      "confidence": 0.65,
      "inference_flags": [
        "first_pass_semantic_generation"
      ],
      "ambiguities": []
    },
    "test_design_hints": {
      "gherkin_intent": "Where an order or trade fails the price validation check, Members are required to contact the Exchange to explain the rationale as to the price of the rejected order or trade.",
      "positive_scenarios": [
        "happy path for obligation"
      ],
      "negative_scenarios": [],
      "boundary_scenarios": [],
      "data_requirements": [
        "price"
      ],
      "oracle_notes": [
        "First-pass machine-generated semantic rule."
      ]
    }
  },
  {
    "semantic_rule_id": "SR-MR-004-02",
    "version": "1.0",
    "source": {
      "doc_id": "lme_matching_rules_v2_2",
      "doc_title": "LME Matching Rules",
      "doc_version": "2.2",
      "section": "General Information",
      "clause_refs": [
        "4"
      ],
      "atomic_rule_ids": [
        "MR-004-02"
      ],
      "pages": [
        3
      ]
    },
    "classification": {
      "rule_type": "deadline",
      "rule_tags": [
        "timing"
      ],
      "testability": "testable",
      "priority": "high",
      "coverage_eligible": true
    },
    "statement": {
      "actor": {
        "value": "unspecified_actor",
        "source_type": "inferred"
      },
      "action": {
        "value": "unspecified_action",
        "source_type": "inferred"
      },
      "object": {
        "value": "trade",
        "source_type": "normalized"
      },
      "conditions": [],
      "constraints": [],
      "outcome": {
        "kind": "timeliness_requirement",
        "expected_state": "deadline_must_be_met",
        "details": {}
      },
      "exceptions": []
    },
    "type_payload": {
      "deadline": {
        "deadline_kind": "business_day_cutoff",
        "reference_event": "submission_event",
        "offset_iso8601": null,
        "absolute_time_local": null,
        "timezone": null,
        "business_day_offset": 0,
        "breach_outcome": "late_submission"
      }
    },
    "execution_mapping": {
      "business_inputs": [
        "execution_time",
        "submission_time",
        "trade"
      ],
      "observable_outputs": [
        "recorded_timestamp",
        "deadline_validation_result"
      ],
      "system_events": [
        "unspecified_action"
      ],
      "preconditions_for_execution": [],
      "postconditions_for_execution": [
        "deadline"
      ],
      "dsl_assertions": [
        {
          "target": "deadline_validation_result",
          "operator": "equals",
          "value": "pass"
        }
      ]
    },
    "evidence": [
      {
        "target": "statement",
        "quote": "Requests must be made to LME Post-Trade Operations no later than 15 minutes prior to the relevant deadline(email: posttradeoperations@lme.com",
        "page": 3,
        "atomic_rule_id": "MR-004-02"
      }
    ],
    "review": {
      "confidence": 0.65,
      "inference_flags": [
        "first_pass_semantic_generation"
      ],
      "ambiguities": []
    },
    "test_design_hints": {
      "gherkin_intent": "Requests must be made to LME Post-Trade Operations no later than 15 minutes prior to the relevant deadline(email: posttradeoperations@lme.com",
      "positive_scenarios": [
        "happy path for deadline"
      ],
      "negative_scenarios": [
        "invalid input path"
      ],
      "boundary_scenarios": [
        "boundary timing case"
      ],
      "data_requirements": [
        "timing"
      ],
      "oracle_notes": [
        "First-pass machine-generated semantic rule."
      ]
    }
  }
]